{
  "$schema": "../schemas/project.schema.json",
  "id": "proj-ecg-simulator",
  "slug": "ecg-simulator",
  "title": "ECG Simulator",
  "summary": "Interactive physiology & ECG learning simulator — 3D cardiac anatomy, shared dipole → 12-lead projection, and pathology scenarios (block, AF/flutter, VF/flutter, MI).",
  "problem": "How can we connect tissue-level conduction models to interpretable clinical ECG waveforms — including disease states — without hardcoding lead millivolts?",
  "architecture": "Physiology packs emit effects → PhysiologicalModel → CyclePlan → shared dipole sampler that drives both 3D heart glow and live 12-lead ECG. Scenarios: sinus, conduction block, AF/flutter, VF/flutter, MI.",
  "status": "active",
  "technology": [
    "TypeScript",
    "React",
    "Three.js",
    "Vite",
    "Dipole → 12-lead ECG",
    "Disease simulation packs"
  ],
  "relatedResearchIds": ["q-ecg-conduction", "q-bio-to-compute"],
  "relatedConceptIds": [
    "concept-action-potential",
    "concept-sa-node",
    "concept-av-node",
    "concept-ecg-generation",
    "concept-medicine",
    "concept-biology"
  ],
  "relatedSignalIds": ["sig-cardiac-digital-twins"],
  "relatedFocusIds": ["focus-ecg-simulator"],
  "designPhilosophy": "Prefer mechanistic clarity over black-box accuracy; diseases never hardcode waveforms — they alter physiology once, and glow + ECG update together.",
  "implementation": "Embedded build from CarryLewis/ECG-stimulator (pathology ECG models tip) at /ecg-simulator/.",
  "demoUrl": "/ecg-simulator/",
  "repoUrl": "https://github.com/CarryLewis/ECG-stimulator",
  "createdAt": "2025-09-01",
  "updatedAt": "2026-08-04"
}
